{
  "quiet": false,
  "hooks": {},
  "git": {
    "changelog": "git log --pretty=format:\"* %s (%h)\" ${from}...${to}",
    "requireCleanWorkingDir": true,
    "requireBranch": false,
    "requireUpstream": true,
    "requireCommits": false,
    "requireCommitsFail": true,
    "commitsPath": "",
    "addUntrackedFiles": false,
    "commit": true,
    "commitMessage": "Release ${version}",
    "commitArgs": [],
    "tag": true,
    "tagExclude": null,
    "tagName": null,
    "tagMatch": null,
    "getLatestTagFromAllRefs": false,
    "tagAnnotation": "Release ${version}",
    "tagArgs": [],
    "push": true,
    "pushArgs": ["--follow-tags"],
    "pushRepo": ""
  },
  "npm": {
    "publish": true,
    "publishPath": ".",
    "publishArgs": [],
    "publishPackageManager": "npm",
    "tag": null,
    "stage": false,
    "otp": null,
    "ignoreVersion": false,
    "allowSameVersion": false,
    "versionArgs": [],
    "skipChecks": false,
    "timeout": 10
  },
  "github": {
    "release": false,
    "releaseName": "Release ${version}",
    "releaseNotes": null,
    "autoGenerate": false,
    "preRelease": false,
    "draft": false,
    "tokenRef": "GITHUB_TOKEN",
    "assets": null,
    "host": null,
    "timeout": 0,
    "proxy": null,
    "skipChecks": false,
    "web": false,
    "comments": {
      "submit": false,
      "issue": ":rocket: _This issue has been resolved in v${version}. See [${releaseName}](${releaseUrl}) for release notes._",
      "pr": ":rocket: _This pull request is included in v${version}. See [${releaseName}](${releaseUrl}) for release notes._"
    }
  },
  "gitlab": {
    "release": false,
    "releaseName": "Release ${version}",
    "releaseNotes": null,
    "milestones": [],
    "tokenRef": "GITLAB_TOKEN",
    "tokenHeader": "Private-Token",
    "certificateAuthorityFile": null,
    "secure": true,
    "proxy": false,
    "assets": null,
    "useIdsForUrls": false,
    "useGenericPackageRepositoryForAssets": false,
    "genericPackageRepositoryName": "release-it",
    "origin": null,
    "skipChecks": false,
    "repoId": null
  }
}
